,Unnamed: 0.1,image,imagem,links,noticia,titulos,estacoes,categorias
0,,25out2017---e-preciso-ter-ao-menos-342-deputados-com-presenca-registrada-no-plenario-para-votar-a-denuncia-as-13h-o-sistema-da-camara-apontava-a-presenca-de-370-deputados-na-camara-mas-apenas-281-1508947940250_300x200.jpg,,https://noticias.uol.com.br/politica/eleicoes/2018/noticias/agencia-estado/2018/06/05/manifesto-pela-uniao-do-centro-defende-reformas-sem-aumento-de-impostos.htm,"Wilton Junior/Estadão Conteúdo<p> Em manifesto pregando união do centro nas eleições deste ano, lideranças do PSDB, DEM, PPS, MDB, PTB e PV apresentam 17 propostas para que o candidato à Presidência da República apoiado pelo grupo defenda. Entre as medidas, estão ""modernização"" do licenciamento ambiental, reformas da previdência e tributária, sem aumento de impostos, e mudanças no Bolsa Família.<p> No documento, que será lançado na tarde desta terça-feira, 5, essas lideranças dizem que as eleições deste ano se apresentam, talvez, como a ""mais complexa e indecifrável"" de todo o período da redemocratização e que, nesse momento, tudo que o Brasil não precisa é de ""mais intolerância, radicalismo e instabilidade"". Afirmam também que é ""central"" a construção de um novo ambiente político, que privilegie diálogo, serenidade, experiência, competência e respeito à diversidade.<p> ""É neste sentido que as lideranças políticas que assinam este manifesto conclamam todas as forças democráticas e reformistas a se unirem em torno de um projeto nacional, que a um só tempo, dê conta de inaugurar um novo ciclo de desenvolvimento social e econômico, a partir dos avanços já alcançados nos últimos anos, e afaste um horizonte nebuloso de confrontação entre populismos radicais, autoritários e anacrônicos"", diz o texto.<p> Nas propostas de agenda apresentadas, essas lideranças pregam a ""busca incansável do equilíbrio fiscal"", o que, na avaliação delas, passa inevitavelmente pela ""Reforma do Estado"". Defendem, por exemplo, ""mudança estrutural"" no sistema tributário para torná-lo mais ""simples, justo, desburocratizado e eficiente"", mas ponderam que esse ""ajuste fiscal não pode se dar com aumento da já alta carga tributária"".<p> O manifesto também prega reforma no sistema previdenciário atual, classificado como ""injusto e insustentável"". ""Precisamos de um sistema único, que elimine privilégios e assegure o equilíbrio atuarial, sob pena de colocarmos em risco o pagamento de aposentadorias e pensões no curto prazo e impedir o necessário equilíbrio das contas públicas"", afirma o documento.<p> As lideranças defendem um ""novo marco"" para concessão de estímulo e subsídios a empresários e indústria, marcado por intervenção estatal ""seletiva e muito calibrada"". E pregam a ""modernização da atividade de licenciamento ambiental"", para desburocratizar e dar ""mais celeridade"" às licenças. Na área da segurança, defendem ""postura firme"" e ""tolerância zero"" com o crime organizado, sem aprofundar as medidas.<p> Na área social, o manifesto defende qualificação do Sistema Único de Saúde (SUS) e ""aprimoramento"" de programas de assistência social para dar-lhes ""caráter transformador"". ""Um exemplo é o Bolsa Família, que deve ser mantido, recuperando seu caráter educacional de quando foi criado com o nome de Bolsa Escola, reunindo propósitos de transferência de renda e garantia de acesso de todos à educação de qualidade"", diz trecho do documento."," Pré-candidato tucano no RS, Leite propõe privatizar empresas públicas ",set(),"{'ptb', 'mdb', 'pv', 'psdb', 'dem', 'pps'}"
0,,31mai2018---participam-da-marcha-para-jesus-o-senador-magno-malta-a-esq-o-deputado-federal-major-olimpio-centro-e-o-deputado-federal-jair-bolsonaro-1527803764342_300x200.jpg,,https://noticias.uol.com.br/politica/eleicoes/2018/noticias/agencia-estado/2018/06/05/rede-de-apoio-a-bolsonaro-reune-eleitores-com-bandeiras-conflitantes-em-sp.htm,"Edson Lopes Jr./UOL<p>Bolsonaro (à dir.) e Major Olímpio (cento) na Marcha para Jesus, em São Paulo<p> Instalado em um conjunto apertado de três salas conjugadas na zona norte de São Paulo, o diretório paulista do PSL conta com uma verba de R$ 15 mil mensais do Fundo Partidário para pagar a manutenção da sigla.<p> Sem presença política no maior colégio eleitoral brasileiro e quase nenhum dinheiro em caixa, a pequena legenda do deputado e pré-candidato à Presidência Jair Bolsonaro (RJ) encontrou em um mosaico de grupos de direita a rede de apoio para tentar estruturar o partido nas 645 cidades paulistas.<p> São núcleos de motociclistas, atiradores, maçons, policiais militares e grupos de direita que ajudaram a organizar as manifestações pelo impeachment da presidente cassada Dilma Rousseff, como o ""Avança Brasil"" e ""Nas Ruas"", que formam a base operacional do PSL.<p> Os números das últimas pesquisas de intenção de voto, que mostram Bolsonaro empatado com o ex-governador tucano Geraldo Alckmin na primeira colocação em São Paulo (com 14% no cenário sem Luiz Inácio Lula da Silva), facilitam a missão.<p> Essas correntes têm em comum forte atuação nas redes sociais, mas segundo o presidente do PSL paulista, deputado Major Olímpio, não tem sido fácil administrar as pretensões e bandeiras dos ""bolsonaristas"".<p> ""Quando assumi a presidência do PSL em São Paulo, em abril, peguei terra arrasada. Para organizar o partido, tenho de administrar muita encrenca com ativistas de toda ordem, que nem sempre estão irmanados entre si. Sou o algodão entre cristais"", disse o dirigente.<p> O embate interno mais acalorado entre os influenciadores digitais e políticos começou no último dia 7 de maio após um jantar promovido pela jornalista Joice Hasselmann, pré-candidata do PSL ao Senado, em um restaurante em São Paulo.<p> Reunido no mesmo local com aliados, o ex-prefeito João Doria, pré-candidato a governador pelo PSDB, fez uma saudação à jornalista, que o elogiou publicamente e disse que o apoiaria. Os núcleos político e policial do PSL paulista consideraram a manifestação de Joice imprópria. Abriu-se um debate que por pouco não terminou em racha.<p> A pedido do jornal ""O Estado de S. Paulo"", algumas das principais lideranças do PSL paulista se reuniram na sede do partido para debater quais devem ser as principais bandeiras do partido na campanha eleitoral.<p> Um dos temas abordados foi a questão da intervenção militar. Durante a greve dos caminhoneiros, o nome do pré-candidato surgiu em grupos de WhatsApp de grevistas com mensagens de apoio à volta dos militares ao poder. No final da Marcha para Jesus, na quinta-feira, o próprio Bolsonaro fez questão de marcar distância do grupo ao dizer que nunca encampou essa proposta.<p> ""A gente tem claramente a percepção de que a esquerda está começando a fazer um movimento de ativistas virtuais para fazer desvirtuar essa questão"", disse Carla Zambelli, líder do movimento NasRuas. ""O Jair nunca defendeu a intervenção. O que ele defende é o regime militar e seus valores"", interrompeu o influenciador digital Gil Diniz, que se apresenta nas redes como Carteiro Reaça.<p> Ninguém no grupo acredita que o regime militar brasileiro tenha recorrido a torturas. ""Tortura? Qual tortura?"", perguntou o coronel da PM Reinaldo Vieira. ""Se houve toda essa tortura e repressão durante o governo militar, como o Aloysio Nunes e a Dilma Rousseff chegaram ao poder?"", disse a empresária Letícia Catel.<p> Foi ela quem abordou outro tema sensível ao pré-candidato do PSL: a relação com o movimento feminista. Em uma palestra em 2017, Bolsonaro afirmou que teve cinco filhos, sendo quatro homens. ""Na quinta dei uma fraquejada e veio uma mulher."" O deputado também foi denunciado no Supremo Tribunal Federal pelo crime de racismo contra quilombolas, indígenas, refugiados, mulheres e LGBTs.<p> ""Não foi exatamente isso que ele quis dizer. Tiram as frases dele do contexto para chamá-lo de misógino. É a esquerda que vitimiza as mulheres"", disse Letícia. O youtuber Clovis Jr, conhecido nas redes como Smith Hays, se antecipou ao próximo tópico. ""Sou gay e posso falar sobre essa questão LGBT."" Ele culpa a mídia e acredita que as falas de Bolsonaro são constantemente editadas para prejudicá-lo.<p> Os ativistas falaram sobre o ""preconceito"" que sentem por defender Bolsonaro. A dona de casa Clau de Luca disse ter ouvido relatos de eleitores de Bolsonaro que não assumem publicamente o seu voto porque a mídia ""demoniza"" o presidenciável do PSL.<p> ""Vejam o que aconteceu com (Donald) Trump (presidente dos EUA). Aqui vai ser a mesma coisa"", afirmou Clovis Jr. As informações são do jornal ""O Estado de S. Paulo"".",do UOL,"{'rj', 'sp'}","{'rede', 'psl', 'psdb'}"
0,,5mar2018---o-coordenador-nacional-do-mtst-movimento-dos-trabalhadores-sem-teto-e-pre-candidato-a-presidencia-da-republica-guilherme-boulos-se-filia-oficialmente-ao-psol-1520650599460_300x200.jpg,,https://noticias.uol.com.br/politica/eleicoes/2018/noticias/agencia-estado/2018/06/05/na-bahia-boulos-defende-diversidade-de-candidaturas-de-esquerda.htm,"SUAMY BEYDOUN/AGIF/ESTADÃO CONTEÚDO<p> O pré-candidato do PSOL ao Palácio do Planalto e coordenador do Movimento dos Trabalhadores Sem-Teto (MTST), Guilherme Boulos, defendeu na manhã desta terça-feira (5) a ""diversidade do campo de esquerda"" - e disse não temer que o segundo turno das eleições presidenciais aconteça sem um representante da oposição. Durante a atividade que participou na Escola de Dança da Universidade Federal da Bahia, Boulos também atacou o pré-candidato do PSL à Presidência, Jair Bolsonaro.<p> As declarações do pré-candidato do PSOL foram dadas um dia depois de a <p> ""Não temo (que a esquerda não vá ao segundo turno), porque, se você pegar as candidaturas de centro-direita e de direita no Brasil, todas elas são Temer. Algumas são Temer disfarçado, outras são Temer assumido. O Temer é o governo com maior rejeição da história republicana. É difícil achar na rua quem aprove o Temer. É mais difícil que achar torcedor da Portuguesa de Desportos. E não acredito que o povo vai colocar no segundo turno duas candidaturas que represente Temer"", avaliou.<p> Boulos também disse que ""ninguém está esperando decisões do PT"" e se recusou a comentar os possíveis substitutos do ex-presidente Luiz Inácio Lula da Silva em caso de impugnação da candidatura do líder petista pelo Tribunal Superior Eleitoral (TSE). ""Eu não sou militante do PT, eu não posso dizer os caminhos que o PT vai tomar"", disse, ao chegar à Escola de Dança da UFBA.<p> O pré-candidato do PSOL ainda atacou Jair Bolsonaro. ""O Bolsonaro se aproveita de um momento de fragilidade da sociedade brasileira, de um momento de medo e de insegurança. Quando as pessoas estão com medo, elas ficam vulneráveis ao ódio, ao discurso de que a solução é na porrada. É dessa maneira que o Bolsonaro faz o populismo da violência, o seu populismo da intolerância. Mas eu não acredito que esse tipo de discurso e de prática tenha condições de ganhar as eleições no Brasil. O povo brasileiro vai saber desmascarar essa farsa. O Bolsonaro é um impostor"", afirmou.<p> Boulos foi acompanhado pelos pré-candidatos do PSOL ao governo da Bahia e ao Senado, Marcos Mendes e Fábio Nogueira, respectivamente, e pelo vereador da legenda em Salvador Hilton Coelho, que disputará uma vaga na Assembleia Legislativa da Bahia em outubro. Antes do evento, eles fizeram reuniões para alinhar o discurso com vistas às campanhas eleitorais do PSOL na Bahia.<p> Na Bahia, onde fica até quarta-feira, 6, o pré-candidato do PSOL também visitará terreiros de candomblé, comunidades populares em Feira de Santana, segundo maior município do Estado, e fará debates na Faculdade de Direito da UFBA e na Universidade do Estado da Bahia (UNEB).", PCdoB deve anunciar sindicalista para vice de Manuela D'Ávila ,{'ba'},"{'psol', 'psl', 'pt'}"
0,,7out2012---marcio-lacerda-psb-comemora-reeleicao-para-a-prefeitura-de-belo-horizonte-mg-1349656583337_300x200.jpg,,https://noticias.uol.com.br/politica/eleicoes/2018/noticias/agencia-estado/2018/06/05/pdt-e-pros-fecham-alianca-com-marcio-lacerda-em-minas-gerais.htm,"Washington Alves/UOL<p>Ex-prefeito de Belo Horizonte, Lacerda deve ser candidato ao governo<p> A pré-candidatura de Marcio Lacerda (PSB) ao governo de Minas Gerais ganhou na manhã desta terça-feira (5) o apoio de dois partidos no estado, o PDT e o Pros. As siglas anunciaram composição de chapa com o ex-prefeito de Belo Horizonte, mas não descartaram a possibilidade dele sair como vice em uma eventual aliança com Ciro Gomes (PDT). No entanto, nenhum dos partidos declarou ter alguma alternativa para o governo de Minas.<p> ""Meu objetivo sempre foi ter um palanque adequado para o Ciro em Minas. Mas ninguém pode impedir ninguém de fazer uma mudança de posição que interessa a pessoa e a conjuntura política"", disse o presidente estadual do PDT, Mário Heringer, afirmando ainda que espera manter os três partidos juntos, mesmo que Lacerda decida concorrer à eleição nacional. ""Se for uma opinião pessoal, eu até gostaria que Minas tenha o vice-presidente da República, mas eu espero que o Marcio seja nosso governador.""<p> O ex-prefeito de Belo Horizonte manteve o posicionamento de que é pré-candidato ao governo do Estado, mas disse que a sua candidatura à vice-presidência depende das negociações nacionais. ""É preciso que os dois partidos formalizem aliança para a candidatura presidencial e que o PSB formalize a indicação do candidato a vice. Foi levantada a hipótese do meu nome, mas não foi uma decisão, tem muita conversa pela frente."" Mário Heringer também declarou que espera que a aliança a nível nacional seja acertada.<p> Mesmo com a possibilidade da retirada da pré-candidatura ao governo de Minas, os partidos declararam que, caso Lacerda opte por seguir com Ciro, haveria a necessidade de se conversar sobre um nome substituto na corrida ao Palácio da Liberdade.<p> Já o presidente estadual do PROS, Eros Biondini, disse que o partido não está trabalhando com a hipótese da retirada da pré-candidatura de Lacerda ao governo de Minas Gerais. ""O PROS se concentra exclusivamente na discussão de Minas Gerais. Não estamos atrelados a uma mudança de rumo em nível federal. Não estamos cogitando dessa possibilidade."" Biondini ainda declarou que o partido pode indicar o deputado Jaime Martins como candidato a vice-governador.<p> Questionado sobre a possibilidade de uma negociação entre os diretórios nacionais de PSB e PT, em que Lacerda poderia apoiar o governador mineiro, Fernando Pimentel, em sua tentativa de reeleição, em troca da retirada das candidaturas petistas na Paraíba e no Pernambuco, o ex-prefeito de Belo Horizonte afirmou que isso não passa de um boato. ""Tem três meses que esse assunto surgiu, e ele vem sendo repetidamente requentado na imprensa. Essa hipótese nunca existiu como proposta ou decisão a ser tomada.""",Estadão Conteúdo - Política,"{'mg', 'pe', 'pb'}","{'pros', 'psb', 'pt', 'pdt'}"
0,,0,,http://congressoemfoco.uol.com.br/noticias/pesquisa-confirma-lideranca-de-bolsonaro-ciro-e-haddad-aparecem-a-frente-de-alckmin-e-marina/,0, Dez partidos assinam com TSE compromisso por eleições sem fake news ,set(),set()
0,,0,,http://www.band.com.br/noticias/eleicoes/conteudo.asp?ID=100000916776&t=ainda-ha-tempo-para-desistir-da-candidatura-afirma-maia,0,Estadão Conteúdo - Política,set(),set()
0,,7mar2018---o-presidente-da-camara-deputado-rodrigo-maia-dem-rj-durante-entrevista-a-folha-para-falar-sobre-o-lancamento-de-sua-pre-candidatura-a-presidencia-nas-eleicoes-desse-ano-1520516890963_300x200.jpg,,https://noticias.uol.com.br/politica/eleicoes/2018/noticias/agencia-estado/2018/06/05/ainda-ha-tempo-para-desistir-de-candidatura-afirma-maia.htm,"Pedro Ladeira/Folhapress<p> O presidente da Câmara dos Deputados, Rodrigo Maia (DEM-RJ), evitou nesta terça-feira (5) responder se poderá abrir mão de sua candidatura ao Palácio do Planalto para apoiar outro candidato do centro. ""Ainda tem tempo"", respondeu em entrevista ao chegar à Casa.<p> Maia admitiu que está conversando com partidos desse campo político, entre eles, PP, PRB, PR e Solidariedade, para ""tentar aglutinar o maior número possível"" de legendas e aliados em torno de um único projeto presidencial. Como vem mostrando o <p> Embora seja pré-candidato, Maia é um dos principais entusiastas de o centro se unir em torno da candidatura do empresário mineiro Josué Gomes (PR), com quem ele se reuniu na semana passada em Brasília.<p> O PR encomendou pesquisas para testar o nome de Josué e prometeu apresentar o resultado a outras siglas de centro nas próximas semanas.", Ciro alfineta Alckmin e diz que foi 'moleza' ajuste fiscal de SP ,"{'df', 'pr', 'rj'}","{'sd', 'pp', 'prb', 'dem'}"
0,,o-presidente-da-fiesp-paulo-skaf-em-entrevista-ao-uol-na-sede-da-federacao-1471978772306_300x200.jpg,,https://noticias.uol.com.br/politica/eleicoes/2018/noticias/2018/06/05/skaf-e-doria-serao-os-ultimos-sabatinados-por-uol-folha-e-sbt.htm,"Bruno Santos/UOL<p>O presidente da Fiesp, Paulo Skaf, em entrevista ao UOL na sede da federação<p> Os pré-candidatos Paulo Skaf (MDB) e João Doria (PSDB) serão os últimos entrevistados em sabatinas promovidas pelo <p> A sabatina com Skaf acontece nesta sexta-feira (8); a de Doria será realizada na próxima segunda-feira (11). Ambas terão uma hora de duração e serão transmitidas ao vivo a partir das 10h.<p> Nas sabatinas, tanto Skaf quanto Doria serão entrevistados pelos jornalistas Diogo Pinheiro, chefe de reportagem do <p> Esta é a terceira eleição consecutiva em que o <p> As regras de participação nas sabatinas e debates foram definidas em reunião na sede do SBT no dia 22 de março, com representantes de 18 dos 35 partidos registrados no TSE (Tribunal Superior Eleitoral).<p> Foram convidados os quatro candidatos ao governo de SP mais bem colocados na pesquisa Datafolha divulgada em 16 de abril. Já foram realizadas sabatinas com Luiz Marinho (PT) e Márcio França (PSB).<p> Skaf, presidente da Fiesp (Federação das Indústrias do Estado de São Paulo), será o terceiro a ser sabatinado entre os pré-candidatos ao governo estadual. <p> Essa será a terceira candidatura seguida de Skaf para o governo paulista. Em 2010, então filiado ao PSB, o empresário obteve pouco mais de um milhão de votos e não avançou ao segundo turno –vencido por Geraldo Alckmin (PSDB). Em 2014, o tucano se reelegeu já no primeiro turno –mas Skaf, no PMDB (hoje MDB), ficou na segunda colocação com mais que o quádruplo de votos de 2010: cerca de 4,5 milhões.<p> Nos últimos anos, à frente da Fiesp, Skaf liderou o movimento contra a alta de impostos ""Não vou pagar o pato"" – em que o pato amarelo gigante acabou se tornando símbolo também dos atos de rua, apoiados pela entidade, favoráveis ao impeachment da então presidente Dilma Rousseff (PT).<p> Doria será o quarto e último nome a ser sabatinado entre os postulantes ao governo estadual.<p> ",Band,{'sp'},"{'mdb', 'psdb', 'psb', 'pt'}"
0,,21mai2018---o-pre-candidato-a-presidencia-ciro-gomes-pdt-participa-de-sabatina-do-uol-folha-de-s-paulo-e-sbt-1526908779330_300x200.jpg,,https://noticias.uol.com.br/politica/eleicoes/2018/noticias/agencia-estado/2018/06/05/centro-e-esquerda-atuam-por-candidaturas-unicas.htm,"Carine Wallauer/UOL<p>Para professor, Ciro Gomes (foto) poderia se beneficiar de aliança de esquerda<p> A um mês e meio do início das convenções partidárias que vão definir os candidatos ao Palácio do Planalto, o cenário eleitoral começa a indicar uma depuração dos 17 nomes que se apresentaram até agora como pré-candidatos. Na avaliação de especialistas e líderes políticos, as articulações que vão levar a um ""filtro"" das pré-candidaturas serão intensificadas até agosto.<p> O temor de uma eleição polarizada entre um nome da esquerda e o deputado Jair Bolsonaro (PSL-RJ) motivou um grupo de parlamentares e líderes de vários partidos a lançar hoje na Câmara o ""Manifesto do polo democrático"", movimento que vai tentar unificar o ""centro"" em torno de uma candidatura.<p> ""Nós já fizemos o gesto. Se eu não for candidata, os outros três se entendem para nós estarmos unidos? A unidade da esquerda representa isto: nós estaremos todos unidos em uma única candidatura? Os outros três têm essa disposição? Eu não sou óbice"", disse a deputada gaúcha ao Estadão/Broadcast.<p> O objetivo, segundo fontes do PCdoB, é ""chamar o PT à razão"" de que o ex-presidente Luiz Inácio Lula da Silva, condenado e preso na Operação Lava Jato, terá a candidatura barrada pela Lei Ficha Limpa e dificilmente deixará a prisão até a eleição. Lula foi sentenciado em segunda instância a 12 anos e 1 mês por corrupção passiva e lavagem de dinheiro.<p> Na análise do cientista político Marco Antonio Teixeira, professor do departamento de gestão pública da FGV-SP, a tendência é de que as pré-candidaturas de centro-esquerda e esquerda se afunilem mais rapidamente na comparação com o campo do centro. ""É possível que PDT, PSB e PCdoB se acertem antes do primeiro turno e fortaleçam a campanha de Ciro Gomes"", afirmou.<p> Reservadamente, deputados e líderes partidários dizem que depois da Copa do Mundo o debate deve avançar para a escolhas de nomes que devem compor a chapa nos dois campos. Os partidos que indicarem os candidatos a presidente e a vice terão que sacrificar projetos estaduais em nome da unidade. ""O processo vai se afunilar. Haverá uma diminuição no número de candidatos"", disse o presidente do PPS, Roberto Freire.<p> O autointitulado ""polo democrático"" é formado por parlamentares do PSDB, DEM, PPS, PSD, PTB e PV e intelectuais. Um dos critérios para a união em torno de um candidato único é a avaliação das pesquisas de intenção de voto. A sigla tucana, porém, não aceita que este seja o único.<p> ""Esse não é um movimento de avaliação de pesquisas, de ver quem está melhor. Se fosse nortear por pesquisa, não precisava de carta. É uma mobilização que tem como pano de fundo a ideia de alertar o risco que corre o País de ter um rumo de radicalismo muito à esquerda ou muito à direita"", disse o deputado Silvio Torres (SP), secretário-geral do PSDB.<p> Entre os signatários do manifesto que será lançado hoje está o ex-presidente Fernando Henrique Cardoso.<p> Segundo o deputado Marcus Pestana (MG), secretário-geral do PSDB, a ideia é iniciar conversas a partir desta quarta-feira, 6, com oito pré-candidatos: Geraldo Alckmin (PSDB), Henrique Meirelles (MDB), Alvaro Dias (Podemos), Flávio Rocha (PRB), Rodrigo Maia (DEM), Paulo Rabello de Castro (PSC), Josué Gomes - nome que passou a ser cogitado pelo PR - e até Marina Silva (Rede).<p> O movimento surge no momento em que PR, DEM, PRB e PP se articulam para negociar em bloco uma posição no tabuleiro eleitoral. Segundo informou a Coluna do Estadão, o nome do empresário mineiro Josué Gomes desponta como favorito à frente de Maia e Rocha.<p> ""A convergência pode acontecer antes das convenções ou ao longo do primeiro turno. A gente pode ficar fora do segundo turno se houver dispersão, como ocorreu em 1989. O risco é real"", disse Pestana. ""Esse campo está engarrafado. Vamos tentar chegar a um consenso"", completou o deputado Heráclito Fortes (DEM-PI), um dos organizadores do manifesto. O documento conta até 30 assinaturas.<p> No processo de filtro do cenário eleitoral, já há, porém, candidaturas consolidadas, como a da ex-ministra Marina Silva, da Rede. ""Participar de conversas é ótimo e democrático, mas não há cogitação de Marina não ser candidata à Presidência. Estamos dispostos a enfrentar a campanha sozinhos se for o caso"", disse o deputado Miro Teixeira (Rede-RJ). As informações são do jornal ""O Estado de S. Paulo'.", PDT e PSB se aproximam e formalizam aliança em favor de Márcio Lacerda em Minas Gerais ,"{'mg', 'rj', 'sp', 'pi', 'pr'}","{'ptb', 'mdb', 'pv', 'pdt', 'psb', 'pt', 'psdb', 'dem', 'rede', 'pps', 'psc', 'pp', 'psd', 'psl', 'prb', 'pcdob', 'pode'}"
