,Unnamed: 0.1,image,imagem,links,noticia,titulos,estacoes,categorias
0,0.0,o-presidente-da-fiesp-paulo-skaf-em-entrevista-ao-uol-na-sede-da-federacao-1471978772306_300x200.jpg,,https://noticias.uol.com.br/politica/eleicoes/2018/noticias/2018/06/07/uol-folha-e-sbt-entrevistam-paulo-skaf-nesta-sexta.htm,"Bruno Santos/UOL<p>O presidente da Fiesp, Paulo Skaf, é pré-candidato pelo MDB ao governo de São Paulo<p> O <p> Skaf será o terceiro a ser sabatinado entre os postulantes ao governo estadual. <p> Essa será a terceira candidatura seguida de Skaf para o governo paulista. Em 2010, então filiado ao PSB, o empresário obteve pouco mais de um milhão de votos e não avançou ao segundo turno –vencido por Geraldo Alckmin (PSDB). Em 2014, o tucano se reelegeu já no primeiro turno –mas Skaf, então no PMDB (hoje MDB), ficou na segunda colocação, somando mais do que o quádruplo de votos de 2010: cerca de 4,5 milhões.<p> À frente da Fiesp, Skaf liderou nos últimos anos o movimento contra a alta de impostos ""Não vou pagar o pato"" – em que o pato amarelo gigante acabou se tornando símbolo também dos atos de rua, apoiados pela entidade, <p> Posteriormente, a entidade e seu presidente <p> Na sabatina, Skaf será entrevistado pelos jornalistas Diogo Pinheiro, chefe de reportagem do <p> Esta é a terceira eleição consecutiva em que o <p> As regras de participação nas sabatinas e debates foram definidas em reunião na sede do SBT no dia 22 de março, com representantes de 18 dos 35 partidos registrados no TSE (Tribunal Superior Eleitoral).<p> Foram convidados os quatro candidatos ao governo de SP mais bem colocados na pesquisa Datafolha divulgada em 16 de abril.<p> O debate de primeiro turno com os pré-candidatos está previsto para o dia 19 de setembro. Em um eventual segundo turno, o debate será realizado no dia 10 de outubro. Os eventos terão duração de uma hora e vinte minutos (das 18h25 às 19h45) e serão realizados no estúdio do SBT.<p> A transmissão ao vivo será feita em TV aberta, nos sites do <p> Na série de sabatinas com os presidenciáveis, já foram entrevistados <p> Foram convidados os seis candidatos à Presidência mais bem colocados na pesquisa Datafolha divulgada em 16 de abril. Joaquim Barbosa (PSB) desistiu de uma possível candidatura. Com a prisão do ex-presidente Luiz Inácio Lula da Silva, que lidera a pesquisa, Alvaro Dias, o sétimo colocado no levantamento, foi convidado.<p> Convidado, ","UOL, Folha e SBT entrevistam Paulo Skaf nesta sexta",{'sp'},"{'mdb', 'psdb', 'psb'}"
1,0.0,21jun2016---o-deputado-federal-jair-bolsonaro-psc-rj-tornou-se-reu-em-duas-acoes-penais-no-stf-supremo-tribunal-federal-nesta-terca-feira-21-ele-respondera-por-incitacao-ao-crime-de-estupro-e-uma-1466544100713_300x200.jpg,,https://noticias.uol.com.br/politica/eleicoes/2018/noticias/2018/06/07/projeto-bolsonaro-stf.htm,"Myke Sena - 21.jun.2016/Framephoto/Estadão Conteúdo<p> Duas das propostas para o sistema penitenciário do pré-candidato à Presidência da República Jair Bolsonaro (PSL) contrariam decisões recentes do STF (Supremo Tribunal Federal).<p> Nesta quarta-feira (6), Bolsonaro afirmou, em sabatina de pré-candidatos promovida pelo jornal Correio Braziliense, que a atual superlotação dos presídios brasileiros é um problema ""de quem cometeu o crime"" e defendeu acabar com as audiências de custódia.<p> Atualmente, o Brasil tem uma taxa de superlotação nas cadeias de 197,4%, o que significa que existe quase o dobro de detentos em relação ao número de vagas.<p> A audiência de custódia consiste na apresentação do preso a um juiz em até 24 horas após a prisão. O objetivo é que a Justiça possa verificar as condições da prisão, como, por exemplo se houve maus tratos ao preso, e determinar se juridicamente há a necessidade de manter o suspeito encarcerado ou se ele pode responder ao processo em liberdade.<p> As audiências de custódia são apontadas como uma forma de evitar a superlotação das cadeias e a prática de abusos pelas forças policiais.<p> ""Eu acho que a chance de alguém que pratica um furto ficar detido é zero junto com a audiência de custódia. Tem de acabar com isso. E não vem com essa historinha 'ah, os presídios são cheios e não recuperam ninguém'. É problema de quem cometeu o crime"", disse Bolsonaro.<p> ",Propostas de Bolsonaro sobre presos contrariam decisões do STF,set(),{'psl'}
2,0.0,pt-lanca-site-de-crowdfunding-para-campanha-de-lula-1528292857408_300x200.jpg,,https://noticias.uol.com.br/politica/eleicoes/2018/noticias/2018/06/07/lula-arrecada-r-50-mil-no-1-dia-o-que-acontece-se-ele-nao-for-candidato.htm,"Reprodução<p>Imagem do site de financiamento coletivo para a campanha de Lula lançado pelo PT<p> Segundo o PT, não há um valor específico de meta a ser arrecadada para a vaquinha. Entre os apoiadores, figuram nomes como a filósofa Márcia Tiburi e os ex-ministros de gestões petistas Ideli Salvatti e Ricardo Berzoini. Até as 11h desta quinta (7) -- um dia depois do site ter sido lançado --, o valor já ultrapassava R$ 70 mil, e mais de 800 pessoas já haviam doado.<p> Lula está preso na sede da PF (Polícia Federal) em Curitiba desde o dia 7 de abril. Ele cumpre pena de 12 anos e um mês de prisão após ser condenado por lavagem de dinheiro e corrupção passiva no caso do tríplex em Guarujá (SP).<p> O PT tem insistido que, mesmo preso, Lula será o candidato do partido à Presidência da República nas eleições deste ano. Condenado em segunda instância pelo TRF-4 (Tribunal Regional Federal da 4ª Região), o ex-presidente se encontra, em tese, inelegível pela Lei da Ficha Limpa e pode ter sua candidatura indeferida pelo TSE (Tribunal Superior Eleitoral).<p> Essa forma de arrecadação passou a ser <p> Mas o que acontece com o dinheiro arrecadado caso a candidatura de Lula seja impedida pela Justiça Eleitoral? Ele pode ser usado pelo PT ou deve ser devolvido aos doadores? Diante da nova lei, especialistas ouvidos pelo <p> Caso o PT apresente o nome de Lula como candidato na convenção partidária que será realizada em julho e depois registre a candidatura em agosto no TSE, o dinheiro pode ser liberado para uso na campanha.<p> ""Ele [Lula] vai ter o direito de fazer campanha enquanto não houver uma decisão sobre o pedido de registro, que vai ser formulada pela Justiça Eleitoral"", afirma João Fernando Lopes de Carvalho, advogado especialista em direito eleitoral.<p> ""É apresentado o registro no TSE e ele começa a fazer campanha. Há uma disposição na lei das eleições de que a pessoa com candidatura sub júdice [em julgamento] pode fazer campanha normalmente"", diz Daniel Falcão, professor do IDP e especialista em direito eleitoral e constitucional.<p> Falcão afirma ainda que não existe um prazo obrigatório a ser cumprido pelo TSE para pronunciamento, apesar de o tribunal ter estabelecido em resolução que deve julgar os registros de candidatura até 17 de setembro. <p> A lei eleitoral estabelece que ""se não for efetivado o registro da candidatura, as entidades arrecadadoras deverão devolver os valores arrecadados aos doadores"".<p> Na visão de Falcão, se após o registro do nome de Lula como candidato –e, consequentemente, após o início da campanha-- houver uma decisão da Justiça Eleitoral que indefira a candidatura, é possível que o PT não precise devolver o dinheiro arrecadado na vaquinha.<p> ""No caso de a candidatura acontecer, nem que seja por alguns dias, ou seja, se for feito o registro do Lula e depois for indeferido pelo TSE, aí eu não vejo necessidade de devolver"", afirma.<p> ""O eleitor do Lula, que é justamente quem está doando, sabe dessa situação e sabe que provavelmente ele não vai poder ser candidato"", pontua.<p> Já no caso de o PT não apresentar o nome de Lula como candidato na convenção partidária, em julho, e decidir inscrever outro nome no TSE ou mesmo desistir de ter uma candidatura próprio, o dinheiro tem que ser devolvido.<p> ""É possível que nessa conjuntura ele [Lula] se apresente como pré-candidato, faça essa movimentação, mas no momento da convenção não venha a propor ao partido o seu nome. Nesse caso, se aplicada a lei, então esse dinheiro tem que ser devolvido"", afirma Carvalho.<p> ""Se até 15 de agosto o Lula não for registrado, eu entenderia isso como uma espécie de não confirmação da pré-candidatura, e o dinheiro tem que ser devolvido"", reforça Falcão.<p> Nesse caso, Carvalho aponta que a devolução do dinheiro deve ser feita pela empresa contratada para administrar a plataforma de financiamento coletivo.<p> ""É o primeiro ano em que se usa vaquinha, em que o sistema de arrecadação antes da campanha é utilizado, então há uma série de dúvidas. Mas me parece que o caminho a ser seguido é este, a empresa devolver [o dinheiro]"", afirma.<p> O partido organiza um ",Vaquinha de Lula soma R$ 56 mil no 1º dia; ele poderá usar o dinheiro?,"{'pr', 'sp'}",{'pt'}
3,0.0,0,,http://www.band.com.br/noticias/eleicoes/conteudo.asp?ID=100000917076&t=bolsonaro-diz-que-na-eleicao-pesara-sempre-suspeicao-de-fraude,0,Bolsonaro diz que na eleição 'pesará sempre suspeição de fraude',set(),set()
4,0.0,0,,http://congressoemfoco.uol.com.br/noticias/%e2%80%9cameaca-ao-sigilo-do-voto%e2%80%9d-stf-derruba-voto-impresso-nas-eleicoes-deste-ano-por-8-votos-a-2/,0,"""Ameaça ao sigilo do voto"": STF derruba voto impresso nas eleições deste ano por 8 votos a 2",set(),set()
5,0.0,0,,https://noticias.uol.com.br/politica/eleicoes/2018/noticias/2018/06/06/pre-candidato-no-rs-bandeira-propoe-privatizar-a-ceee-e-o-banrisul.htm,0,"Pré-candidato no RS, Bandeira propõe privatizar a CEEE e o Banrisul",set(),set()
6,0.0,03abr2018---antes-de-deixar-o-cargo-o-governador-do-estado-de-sao-paulo-geraldo-alckmin-assina-diversos-convenios-com-desenvolve-sp-1523470795568_300x200.jpg,,https://noticias.uol.com.br/politica/eleicoes/2018/noticias/2018/06/06/alckmin-sobre-pressao-para-decolar-nao-tem-estresse-mas-divergencias.htm,"Eliane Neves/Fotoarena/Estadão Conteúdo<p> O ex-governador de São Paulo Geraldo Alckmin (PSDB) minimizou nesta quarta-feira (6) a pressão do próprio partido para deslanchar sua pré-campanha à Presidência da República. ""Não tem estresse. Tem divergências em partido grande"", afirmou, durante sabatina do jornal Correio Braziliense. <p> Em reunião com lideranças do PSDB, <p> Alckmin disse não se impressionar com as pesquisas neste momento, no qual conta com até 10% das intenções de votos nas últimas pesquisas. ""Vamos fazer uma grande aliança. Nós temos hoje praticamente cinco partidos. Nós não vamos divulgar, eles que divulguem, cada um a seu tempo. A gente não pode ser afobado com essas coisas"", afirmou.<p> ""Começar campanha com 7%, 8%, 10% é ótimo"", disse Alckmin, relembrando o caso do ex-prefeito de São Paulo João Doria (PSDB), que começou a campanha de 2016 com apenas um dígito nas pesquisas e acabou eleito no primeiro turno<p> Questionado também sobre o impacto do ex-diretor da Dersa, Paulo Vieira de Souza, o Paulo Preto — apontado como operador do PSDB — em sua campanha, Alckmin foi enfático: ""Nenhum"". O ex-governador ainda disse que risco de ser citado em uma eventual delação é ""zero"". ""Ele mesmo disse à revista Época que nunca me conheceu"", afirmou.<p> Quando perguntado se a situação do senador tucano Aécio Neves (MG) poderia afetar a campanha, Alckmin partiu para o ataque. ""O PSDB não passa a mão na cabeça de ninguém. Todos nós estamos debaixo da lei, contra qualquer tipo de privilégio. Diferente de outros partidos que fazem acampamento na porta de penitenciária.""","Não tem estresse, mas divergências, diz Alckmin sobre pressão para decolar","{'mg', 'sp'}",{'psdb'}
7,0.0,eleicoes-2018---manuela-davila-pcdob-1524340764824_300x200.jpg,,https://noticias.uol.com.br/politica/eleicoes/2018/noticias/agencia-estado/2018/06/06/manuela-davila-diz-que-eleicao-tera-quatro-candidatos-de-esquerda.htm,"Divulgação<p> Depois de sinalizar, em entrevista ao Estadão/Broadcast, que poderia abrir mão de sua postulação à Presidência da República, a deputada estadual gaúcha Manuela D'Ávila (PCdoB) disse nesta quarta-feira, 6, que a tendência no campo da esquerda é a pulverização em quatro nomes.<p> Manuela ponderou que o cenário não é o que ela deseja, mas que seu partido fez todos os gestos que podia em prol de uma união com os pré-candidatos do PT, do PDT e do PSOL: o ex-presidente Luiz Inácio Lula da Silva, condenado e preso em Curitiba, o ex-ministro Ciro Gomes e Guilherme Boulos.<p> ""Exaurimos os nossos gestos. Acredito que o desfecho será termos quatro pré-candidaturas. Somos oponentes, adversários estão do lado de lá"", disse durante sabatina promovida pelo jornal Correio Braziliense e pelo Sindicato Nacional dos Auditores Fiscais da Receita Federal do Brasil (Sindifisco Nacional).<p> Manuela não se considera um óbice à união entre os autointitulados progressistas, mas afirmou que a ""vida real"" é diferente e que considera um avanço ter assinado um programa com propostas comuns para a crise nacional com Lula, Ciro e Boulos.<p> Manuela disse ser contra a venda da participação pública nas empresas estatais e acusou o governo de querer promover o desmonte do Estado. Manuela considera que o Brasil vive um processo de desindustrialização ""severo"" e que não é possível repensar a retomada da atividade industrial entregando o controle das atividades energéticas a multinacionais.<p> Ela argumentou que os bancos públicos são fundamentais para disputar as tarifas de juros no mercado com as instituições privadas e propôs desenvolver mecanismos de controle contra a corrupção nas estatais.<p> ""Petrobras, Banco do Brasil, Caixa e Eletrobrás são fundamentais para o desenvolvimento do Brasil e retomada do crescimento da economia. Privatização não é um debate moral, é um debate estratégico sobre o que o Brasil precisa ou não para se desenvolver como nação. Se a Petrobras é tão importante, temos que garantir que esteja imune a atos de corrupção.""<p> Manuela disse que, num eventual governo comunista, poderá haver interferência do governo no Banco Central do Brasil, reduzindo a autonomia informal dada ao banco atualmente. ""O Banco Central tem que fazer parte do projeto de desenvolvimento do País. O Estado mínimo só é mínimo para o povo brasileiro, mas é máximo para garantir juros altos para os bancos. A quem serve a autonomia total do BC. Só serve para o sistema financeiro, não serve pera o povo brasileiro.""",Manuela D'Ávila diz que eleição terá quatro candidatos de esquerda,{'pr'},"{'psol', 'pdt', 'pcdob', 'pt'}"
8,0.0,0,,http://www.band.com.br/noticias/eleicoes/conteudo.asp?ID=100000917067&t=ciro-chama-bolsonaro-de-bocal-e-de-cancer-que-deve-ser-extirpado,0,Ciro chama Bolsonaro de boçal e de 'câncer que deve ser extirpado',set(),set()
9,0.0,0,,http://www.band.com.br/noticias/eleicoes/conteudo.asp?ID=100000917064&t=bolsonaro-diz-que-nao-vai-aumentar-impostos-se-for-eleito,0,Bolsonaro diz que não vai aumentar impostos se for eleito,set(),set()
10,0.0,25jan2018--a-senadora-gleisi-hoffmann-pr-e-o-ex-presidente-luiz-inacio-lula-da-silva-participam-de-reuniao-da-direcao-nacional-do-pt-um-dia-apos-a-condenacao-de-lula-no-trf-4-tribunal-regional-1516889596526_300x200.jpg,,https://noticias.uol.com.br/politica/eleicoes/2018/noticias/agencia-estado/2018/06/04/gleisi-hoffmann-nega-ser-plano-b-para-lula.htm,"Aloisio Mauricio/Estadão Conteúdo<p> A presidente nacional do PT, senadora Gleisi Hoffmann (PR), negou que pretende ser candidata à Presidência da República como alternativa ao ex-presidente Luiz Inácio Lula da Silva, preso e condenado na Lava Jato.<p> Conforme a <p> ""Aviso reto: não sou candidata a presidente, a vice ou pretendente a ser. O PT tem candidato! É Lula!!! Aceitem, dói menos"", escreveu Gleisi em sua conta no Twitter.<p> A petista classificou a especulação sobre uma alternativa a Lula como um ""imbróglio"" e uma tentativa da mídia de ""semear intrigas"" no partido.<p> A grande mídia insiste em querer definir candidaturas para o PT e semear intrigas. Vi hj meu nome nesse imbróglio. Aviso reto: não sou candidata à presidente, vice ou pretendente a ser. O PT tem candidato! É LULA!!! Aceitem, dói menos", Gleisi Hoffmann nega ser 'plano B' para Lula ,{'pr'},{'pt'}
11,0.0,0,,http://www.band.com.br/noticias/eleicoes/conteudo.asp?ID=100000916656&t=manuela-davila-admite-abrir-mao-de-candidatura-por-uniao-da-esquerda,0,Estadão Conteúdo - Política,set(),set()
12,0.0,1mai2018---ato-em-apoio-ao-ex-presidente-lula-reuniu-aldo-haddad-manuela-boulos-e-gleisi-entre-outros-em-curitiba-1525212776321_300x200.jpg,,https://noticias.uol.com.br/politica/eleicoes/2018/noticias/agencia-estado/2018/06/04/manuela-davila-admite-abrir-mao-de-candidatura-por-uniao-da-esquerda.htm,"Ricardo Stuckert ?/Divulgação<p> A deputada estadual Manuela d'Ávila (PCdoB-RS) admitiu abrir mão de sua pré-candidatura à Presidência da República por uma união de partidos de esquerda já no primeiro turno das eleições presidenciais. Ela condiciona o posicionamento, no entanto, a um gesto do PT, que mantém a pré-candidatura do ex-presidente Luiz Inácio Lula Silva mesmo com o petista preso e condenado na Lava Jato, do PDT, que lançou o ex-ministro Ciro Gomes na corrida, e do PSOL, cujo pré-candidato é Guilherme Boulos.<p> Para Manuela, o PCdoB não é um obstáculo à união das esquerdas, mas o partido não abriria mão de seu nome se as outras legendas do campo não fizessem o mesmo em torno de um único projeto. ""Nós já fizemos o gesto. Se eu não for candidata, os outros três se entendem para nós estarmos unidos? A unidade da esquerda representa isto: nós estaremos todos unidos em uma única candidatura? Os outros três têm essa disposição? Eu não sou óbice"", disse a deputada gaúcha, em conversa com o Estadão/Broadcast.<p> Na semana passada, o líder do PCdoB na Câmara, deputado Orlando Silva (PCdoB), defendeu que os partidos de esquerda se juntem em torno de um único nome se houver o risco de nenhuma das candidaturas do campo chegar ao segundo turno das eleições presidenciais. O partido avalia apoiar outro nome, como o de Ciro Gomes, e lançar Manuela ao governo do Rio Grande do Sul.<p> Nesta segunda-feira, 4, Manuela participou de um fórum sobre reforma tributária promovido por entidades de agentes da Receita Federal e de auditores fiscais estaduais. Após sua participação no evento, a parlamentar foi abordada por um participante que sugeriu que ela aceitasse ser candidata a vice-presidente em uma chapa encabeçada por Ciro Gomes. ""Eu estou convidando ele para ser meu vice. Você acha bonito isso?"", respondeu, em tom de brincadeira.<p> Manuela disse que conversa com Ciro assim como conversa com outros presidenciáveis de esquerda. Ela afirmou que o diálogo vai continuar e que é inadequada a ""troca de farpas"" entre os pré-candidatos desse campo. ""Os problemas do país são infinitamente maiores do que as nossas diferenças."" A deputada afirmou, porém, acreditar que, ""provavelmente"", PCdoB, PT, PDT e PSOL continuarão sendo oponentes no processo eleitoral.<p> Tendo suspendido, em abril, sua pré-campanha para defender a liberdade do ex-presidente Lula, Manuela diz agora que essa não será sua única bandeira no pleito. ""Não é o único tema porque essa não é a única manifestação da crise aguda que o País vive, essa é uma manifestação"", justificou, destacando que continuará pedindo a liberdade do petista toda vez que o assunto surgir nas eleições.<p> Outra bandeira a ser relativizada a partir de agora é a defesa da saída do presidente Michel Temer do poder. Para Manuela, a bandeira do ""Fora, Temer"" vai ser levantada por meio do combate às candidaturas que representem continuidade do governo, já que não haveria mais tempo de defender uma saída do emedebista antes do término do mandato.<p> Em sua participação no fórum, Manuela disse que o governo Temer já virou ""pó"", mas ainda será um ""fantasma"" na campanha eleitoral. ""Embora ele tenha virado pó e seja um governo morto, o seu fantasma ronda um conjunto de outras candidaturas"", falou.<p> Manuela defendeu uma reforma tributária de ""caráter progressivo"", com impostos sobre a renda dos mais riscos e a tributação de lucros e dividendos. Em um discurso de 15 minutos, a presidenciável do PCdoB reconheceu que o próximo governo fará reformas, mas que é preciso escolher entre projetos que atendam ao ""rentismo"" e propostas que defendam os trabalhadores.", Manuela d'Ávila admite abrir mão de candidatura por união da esquerda ,{'rs'},"{'psol', 'pdt', 'pcdob', 'pt'}"
13,0.0,31ago2016---em-seu-discurso-na-fase-de-julgamento-da-presidente-afastada-dilma-rousseff-a-senadora-ana-amelia-lemos-pp-rs-lembrou-o-carater-historico-do-processo-de-impeachment-segundo-ela-a-1472613025774_300x200.jpg,,https://noticias.uol.com.br/politica/eleicoes/2018/noticias/agencia-estado/2018/06/04/partidos-aguardam-aliancas-ao-governo-do-rs-para-fechar-candidatos-a-senado.htm,"Jonas Pereira/Agência Senado<p>Senadora Ana Amélia<p> O cenário ainda incerto em torno da formação das chapas para o governo do Rio Grande do Sul reflete-se na indefinição dos nomes que vão concorrer às duas cadeiras para o Senado pelo Estado. Por enquanto, somente estão confirmados pelos seus respectivos partidos os dois atuais senadores gaúchos Paulo Paim (PT) e Ana Amélia (PR), que tentarão a reeleição.<p> Outros partidos lançaram cinco nomes para o Senado, mas ainda sem bater o martelo - as duas vagas têm sido usadas como moeda de troca para formar alianças na disputa pelo governo do Estado.<p> O MDB, do governador José Ivo Sartori, indica que Germano Rigotto, ex-governador do Estado, poderá ser o nome da sigla para o Senado. Segundo o presidente estadual do partido, o deputado federal Alceu Moreira, Rigotto possui apoio de grande parte dos prefeitos e vereadores do MDB gaúcho e é o ""candidato natural"". O quadro, entretanto, está indefinido, segundo Moreira, para não atrapalhar as negociações com outros partidos para formação da chapa de Sartori, que poderá concorrer à reeleição.<p> Uma dessas ""portas abertas"" é com o PSB. O partido e o MDB são aliados na administração Sartori. De acordo com Moreira, a segunda vaga ao Senado na chapa do MDB estaria destinada a um pessebista. ""Em princípio, se o PSB confirma a parceria conosco, será o Beto Albuquerque"", afirmou. Um entrave, contudo, é que outro pessebista, o ex-prefeito de Porto Alegre José Fortunati, também quer disputar uma vaga no Senado. Ele trocou o PDT pelo PSB este ano justamente com este objetivo.<p> O partido ainda não definiu qual será o apoio para uma eventual candidatura à reeleição de Sartori nem se terá mesmo dois candidatos aos Senado. A reunião que estabeleceria os caminhos da sigla para as eleições ocorreria em 27 de maio, mas foi cancelada devido à greve dos caminhoneiros.<p> ""As candidaturas de Albuquerque e Fortunati dependem muito do partido, de qual coligação vai ser feita"", afirmou o cientista político e professor da Universidade Federal do Rio Grande do Sul (UFRGS) Aragon Dasso Júnior. Segundo o analista, ainda há correntes no PSB que defendem lançar candidatura própria ao Piratini, em vez de fechar aliança com um outro partido, para garantir dois candidatos da legenda ao Senado.<p> Dos principais partidos que possuem candidatos ao Piratini, o PSDB e o PDT ainda indicaram oficialmente nomes para o Senado e estão trabalhando em alianças para compor a chapa. O presidente estadual do PDT, o deputado federal Pompeo de Mattos, afirmou que a vaga ao Senado está colocada na mesa como elemento de troca. ""Está disponível para negociação. Podemos ter candidato, bem como compor com outros partidos"", disse.<p> Para a constituição da chapa de Jairo Jorge ao governo gaúcho, o PDT aguarda as alianças serem feitas para a candidatura de Ciro Gomes ao Planalto. ""Temos esperança com PSB por causa de um acordo nacional que pode acontecer"", afirmou Pompeo de Mattos. Já o PSDB afirmou que ainda não tem nada definido com relação ao Senado.<p> ""Temos três candidaturas claras (Ana Amélia, Paim e Rigotto) e as duas do PSB. Mas, no momento, não consigo enxergar elementos novos"", analisou Dasso Júnior. As novidades, segundo o cientista político, podem surgir do presidente do Grêmio, Romildo Bolzan Júnior (PDT), e do vice-governador do Estado, José Paulo Cairoli (PSD), que já tiveram suas candidaturas ao Senado ventiladas.<p> Nenhum movimento concreto, porém, ocorreu até o agora. Cairoli deverá compor novamente a chapa de Sartori para o governo do Estado. ""Não vejo motivo para mudar o vice-governador"", afirmou Alceu Moreira.<p> Com relação a Bolzan, a candidatura passa por uma escolha pessoal. Segundo Pompeo de Mattos, Romildo estaria focado em trabalhar pelo Grêmio e reiterou que não quer se candidatar. O presidente do PDT, contudo, deixou as portas abertas, dizendo que Bolzan ""não está inelegível"", caso queira concorrer.",Band,"{'rs', 'pr'}","{'mdb', 'pdt', 'psb', 'pt', 'psdb', 'psd', 'pode'}"
