,Unnamed: 0.1,image,imagem,links,noticia,titulos,estacoes,categorias
62,0.0,teste-publico-de-seguranca-da-urna-no-tse-em-2017-1527688795393_300x200.jpg,,https://noticias.uol.com.br/politica/eleicoes/2018/noticias/2018/05/30/tse-anuncia-auditoria-de-urnas-eletronicas-em-tempo-real-nas-eleicoes.htm,"Divulgação/TSE<p>Teste de segurança da urna eletrônica no TSE em 2017<p> O presidente do TSE (Tribunal Superior Eleitoral), Luiz Fux, anunciou nesta quarta-feira (30) que a Corte fará a auditoria de urnas eletrônicas em tempo real nas eleições de outubro deste ano – o primeiro turno está marcado para o dia 7; o segundo, para dia 28.<p> Segundo Fux, a aferição nas urnas eletrônicas acontecerá nas 27 unidades federativas do país enquanto as eleições são realizadas. Os equipamentos a serem verificados serão sorteados para não haver risco de fraudes, informou.<p> O parecer que autoriza a operação foi aprovado nesta terça (29) pela área técnica do tribunal. De acordo com o presidente do TSE, a auditoria em tempo real era um pleito antigo de estudiosos relacionados à área.<p> O sorteio das seções eleitorais cujas urnas serão auditadas acontecerá na véspera do dia da eleição com a presença de representantes dos partidos políticos. A auditoria vai acontecer antes da votação em si e poderá ser acompanhada pela OAB, Ministério Público e representantes dos partidos.<p> O TSE informou que, por turno, serão auditadas por sorteio três urnas nas unidades federativas com até 15 mil seções no cadastro eleitoral; oito nas que tenham de 15.001 a 30 mil seções no cadastro eleitoral; e dez nas demais unidades da federação.<p> A comissão responsável pela auditoria será composta por um juiz de Direito e pelo menos seis servidores da Justiça Eleitoral, entre os quais um da Corregedoria Regional Eleitoral, um da Secretaria Judiciária e um da Secretaria de Tecnologia da Informação.<p> O tribunal informou que não haverá custo adicional para a operação.<p> Antes das eleições, as urnas já eram submetidas a testes públicos, de hackers e a outros de confiabilidade. Mas, de acordo com Fux, a iniciativa de checagem em tempo real foi tomada ""em nome da transparência, legalidade e moralidade"".<p> ""A Justiça Eleitoral tem procurado nortear toda a sua atuação no princípio republicano que caracteriza a atuação pública distinta dos interesses privados. O cidadão tem como maior participação na vida democrática o momento do voto"", declarou Fux.<p> Ele ainda defendeu que as urnas eletrônicas são utilizadas no Brasil há mais de 20 anos sem problemas graves. Cerca de 30 mil dos mais de 532 mil equipamentos neste ano serão substituídos por outros mais modernos. A substituição será gradual e visa, além de modernizá-la, adequá-la a eventuais alterações na legislação.<p> Pela manhã, Fux e o presidente da Câmara dos Deputados, Rodrigo Maia (DEM-RJ), participaram de seminário no TSE sobre a segurança da urna eletrônica para as eleições de outubro deste ano. Técnicos do tribunal mostraram um panorama da informatização do processo eleitoral, além de mitos e verdades sobre a segurança de urnas eletrônicas.<p> O secretário de Tecnologia da Informação do TSE, Giuseppe Janino, negou, por exemplo, que a urna eletrônica seja idealizada por empresas estrangeiras com supostos interesses políticos em manipular resultados. Ele explicou que a urna eletrônica é totalmente desenvolvida por técnicos do tribunal e do governo federal. A empresa vencedora da licitação, portante, apenas a produz seguindo as normas pré-estabelecidas pelo TSE.<p> A expectativa do TSE é que cerca de que <p> Somente os cidadãos em dia com a Justiça Eleitoral poderão participar das próximas eleições. O prazo para emitir, atualizar ou transferir o título de eleitor em todo o país terminou em 9 de maio. Quem não resolveu as pendências até a data só poderá pedir o título ou fazer alterações após as eleições deste ano.<p> O título é cancelado caso o eleitor não tenha votado ou justificado sua ausência por três eleições consecutivas – a Justiça Eleitoral considera cada turno do pleito como uma eleição. Sem o documento válido, os cidadãos podem ter como prejuízo a impossibilidade de participar de concursos públicos e de renovar matrícula em instituição de ensino do governo, por exemplo.",Estadão Conteúdo - Política,{'rj'},{'dem'}
63,0.0,0,,https://www3.uol.com.br/uolmais/2018/05/30/muita-gente-acabou-se-omitindo-diz-franca-sobre-greve.htm,"O governador de São Paulo e pré-candidato à reeleição, Márcio França (PSB), fez críticas à forma como o governo federal negociou o fim da greve dos caminhoneiros, em Brasília, nos últimos dias. Na sabatina UOL-Folha-SBT, França afirmou que o governo do presidente Michel Temer ""se comunicou errado"" e ""falou com as pessoas erradas"" ao se reunir com representantes dos grevistas, no Planalto."," 'Há falta de sensibilidade social crônica neste governo', diz Haddad ","{'df', 'sp'}",{'psb'}
64,0.0,24mai2018---multidao-recepciona-o-deputado-jair-bolsonaro-psl-rj-no-aeroporto-de-salvador-1527604167392_300x200.jpg,,https://noticias.uol.com.br/politica/eleicoes/2018/noticias/2018/05/30/eles-pararam-um-aeroporto-para-receber-bolsonaro.htm,"Ueslei Marcelino - 24.mai.2018/Reuters<p>24.mai.2018 - Multidão recepciona o deputado Jair Bolsonaro (PSL-RJ) no aeroporto de Salvador<p> O assistente administrativo Tiago Silva Santos, 34, aguardava ansioso em sua cadeira de rodas. Os estudantes Gustavo Figueiredo, 21, e Dayane Miranda, 27, passaram a madrugada na estrada para estar ali. A nutricionista soteropolitana Jaqueline Carvalho, 45, foi representar as mulheres baianas. Jogador e professor de tênis de mesa, Ednaldo Souza, 69, comprou duas camisas só para a ocasião.<p> Eles ajudavam a engrossar um coro que repetia gritos de guerra como ""mito"", ""o capitão chegou"" e ""eu vim de graça"". No meio da aglomeração que<p> Os ""bolsonarianos"" foram ouvidos pela reportagem do <p> ", Haddad: programa do PT para eleições terá diversas propostas de PPPs ,"{'ba', 'rj'}",{'psl'}
65,0.0,roberto-robaina-psol-rs-candidato-ao-governo-1407366642234_300x200.jpg,,https://noticias.uol.com.br/politica/eleicoes/2018/noticias/2018/05/29/pre-candidato-ao-governo-do-rs-robaina-critica-superlotacao-de-presidios.htm,"Divulgação<p> O vereador Roberto Robaina (PSOL), 50, é o segundo dos 7 pré-candidatos ao governo do Rio Grande do Sul que serão entrevistados pelo SBT no estado. Graduado em história, mestre e doutor em filosofia, Robaina foi diretor do Sindicato dos Bancários de Porto Alegre.<p> Robaina critica as estatísticas de encarceramento no Estado –segundo ele, o número de presos no Rio Grande do Sul saltou de cerca de 13 mil nos anos 2000, para 40 mil hoje —e defende uma mudança na política de segurança, para que a polícia se dedique ao combate a homicídios, ao latrocínio e ao feminicídio. ""O Estado tem colocado na cadeia jovens pobres, das periferias, que estão ligados ao pequeno comércio de tráfico, e joga nos presídios. Os presídios estão superlotados, os presídios hoje não são controlados pelo estado, são pelas facções criminosas"", disse.<p> Robaina afirma, ainda, estar ""preocupado"" com o desabastecimento de combustíveis no país, em decorrência da greve dos caminhoneiros, e defende a mudança da política de preços da Petrobras e a demissão de Pedro Parente. Ele também critica pedidos de intervenção militar que surgiram com a greve.<p> Assista à entrevista do SBT no vídeo acima.",Estadão Conteúdo - Política,{'rs'},{'psol'}
0,,11abr2018---jaques-wagner-ex-governador-da-bahia-visita-o-acampamento-pro-lula-montado-nos-arredores-da-policia-federal-em-curitiba-pr-1523457960174_300x200.jpg,,https://noticias.uol.com.br/politica/eleicoes/2018/noticias/2018/06/07/jaques-wagner-diz-que-nao-vai-aqui-puxar-tapete-de-lula-em-eleicoes.htm,"Theo Marques/Framephoto/Estadão Conteúdo<p> O ex-governador da Bahia e ex-ministro Jaques Wagner (PT) disse não ter patrimônio político nacional para disputar as eleições presidenciais pelo PT e que não ""vai puxar o tapete"" do ex-presidente Luiz Inácio Lula da Silva, pré-candidato da legenda à Presidência da República.<p> As declarações foram dadas por Wagner do lado de fora da sede da Polícia Federal, em Curitiba, minutos antes de ele entrar no local para visitar o petista, que cumpre pena de 12 anos e um mês de prisão após ser condenado por lavagem de dinheiro e corrupção passiva no caso do tríplex em Guarujá.<p> ""Deixa eu deixar uma coisa clara: eu sei que eu tenho um patrimônio político na Bahia, outro tem em Minas [Gerais], outro tem no Acre, mas o patrimônio político nacional só tem um nome, o patrimônio é dele, pelo o que ele [Lula] construiu ao longo dessa caminhada desde os tempos de sindicato. Se o patrimônio é dele, não está aqui ninguém que vai aqui puxar o tapete ou com mão de gato tomar o lugar que é de um só: Luiz Inácio Lula da Silva"", disse.<p> O ex-governador da Bahia tem sido apontado como ""plano B"" do PT caso Lula tenha a candidatura impedida pelo TSE (Tribunal Superior Eleitoral). Wagner estaria se preparando, no entanto, para disputar uma vaga de senador pelo partido nas eleições deste ano.<p> ""O patrimônio é dele e se é dele não tem que ninguém ficar dando pitaco, quem vai dar o pitaco é o dono do patrimônio e, portanto, a gente tem que esperar a orientação do Lula, para saber que caminho"", disse. ""A orientação dele é 'eu sou inocente, sou candidatíssimo'"", afirmou. <p> Wagner disse ainda que não lavaria a mão que vai apertar a mão de Lula. ""Hoje eu tive a graça que qualquer um de vocês gostaria de ter, mas eu garanto que não vou lavar a mão depois que eu apertar a mão do Lula lá dentro. Venho aqui para apertar a mão abençoada pela mão do Lula"", brincou. ","Jaques Wagner diz que não ""vai aqui puxar tapete"" de Lula em eleições","{'ba', 'ac', 'pr'}",{'pt'}
0,,6jun2018---o-deputado-federal-e-pre-candidato-a-presidencia-da-republica-jair-bolsonaro-psl-rj-durante-sabatina-promovida-pelo-jornal-correio-braziliense-1528308966408_300x200.jpg,,https://noticias.uol.com.br/politica/eleicoes/2018/noticias/agencia-estado/2018/06/07/bolsonaro-e-skaf-se-aproximam-em-sp.htm,"Mateus Bonomi/Agif/Estadão Conteúdo<p>""Skaf era o único nome em São Paulo que eu poderia conversar"", disse Bolsonaro (foto)<p> O deputado Jair Bolsonaro (RJ), presidenciável do PSL, e o empresário Paulo Skaf, pré-candidato do MDB ao governo paulista, iniciaram uma aproximação para uma eventual aliança na disputa pelo Palácio dos Bandeirantes. O PSL busca palanques regionais fortes para compensar falta de estrutura e capilaridade nos Estados.<p> Bolsonaro vê em Skaf o único nome possível para uma composição no maior colégio eleitoral do país. ""Não tenho abertura de conversa com o (João) Doria (pré-candidato do PSB) nem com o (Márcio) França (governador e pré-candidato à reeleição, do PSB). Então, o Skaf era o único nome em São Paulo que eu poderia conversar"", disse o presidenciável do PSL. ""Eu gostei dele e acho que ele também gostou de mim.""<p> As conversas com o emedebista ocorrem em paralelo ao esforço do grupo de Bolsonaro em formar uma frente suprapartidária. A ideia original da legenda em São Paulo era lançar a candidatura da advogada Janaína Pascoal, nome considerado ""competitivo"" por Bolsonaro por ela ter sido uma das signatárias do impeachment da presidente cassada Dilma Rousseff na Câmara. Como Janaína declinou do convite, Bolsonaro ficou sem opções em São Paulo, que possui cerca de 33 milhões de eleitores.<p> Na mais recente pesquisa Ibope/Band de intenção de voto no Estado, divulgada no dia 28 de maio, Bolsonaro apareceu na liderança com 19% ante 15% do ex-governador Geraldo Alckmin, pré-candidato do PSDB.<p> Aliados de Skaf avaliam reservadamente que a aliança poderia dar a Skaf um palanque com a presença de dois presidenciáveis: o ex-ministro da Fazenda Henrique Meirelles e Bolsonaro, além reforçar o discurso da segurança pública - principal mote do presidenciável do PSL.<p> O nome de Bolsonaro, porém, sofre forte resistência dos partidos do ""centro"" que, como o MDB, querem evitar uma polarização entre ele e a esquerda na campanha.<p> Skaf, que se licenciou nesta quarta-feira (6), da presidência da Federação das Indústrias do Estado de São Paulo (Fiesp), tem tratado o assunto com cautela: não quer fechar a porta para um acordo, mas também teme melindrar o Palácio do Planalto, Meirelles e outros potencias aliados.<p> Ainda não está claro para Skaf o impacto de uma eventual aliança, mas o pré-candidato do MDB falou do assunto recentemente com o deputado federal Major Olímpio, presidente do PSL paulista.<p> ""Eu conversei com Skaf como presidente do PSL e naturalmente a eleição paulista entrou no assunto. Pode ser uma vantagem para o Bolsonaro ter uma palanque forte em São Paulo. Para nós é um ponto de honra vencer o PT e o PSDB no Estado"", disse Olímpio.<p> Procurado por meio de sua assessoria, Skaf disse que não iria se manifestar.<p> Segundo o presidente do MDB paulista, deputado federal Baleia Rossi, Skaf está cuidando pessoalmente das alianças em torno da chapa majoritária, enquanto a direção estadual da proporcional. ""Não falo sobre o que não aconteceu"", afirmou Rossi. Até o momento, o MDB não fechou aliança com nenhum partido em São Paulo. As informações são do jornal ""O Estado de S. Paulo"".",Bolsonaro e Skaf se aproximam em SP,"{'rj', 'sp'}","{'mdb', 'psb', 'pt', 'psdb', 'psl'}"
0,,0,,http://www.band.com.br/noticias/eleicoes/conteudo.asp?ID=100000917106&t=bolsonaro-e-skaf-se-aproximam-em-sp,0,Bolsonaro e Skaf se aproximam em SP,set(),set()
0,,21jun2016---o-deputado-federal-jair-bolsonaro-psc-rj-tornou-se-reu-em-duas-acoes-penais-no-stf-supremo-tribunal-federal-nesta-terca-feira-21-ele-respondera-por-incitacao-ao-crime-de-estupro-e-uma-1466544100713_300x200.jpg,,https://noticias.uol.com.br/politica/eleicoes/2018/noticias/2018/06/07/projeto-bolsonaro-stf.htm,"Myke Sena - 21.jun.2016/Framephoto/Estadão Conteúdo<p> Duas das propostas para o sistema penitenciário do pré-candidato à Presidência da República Jair Bolsonaro (PSL) contrariam decisões recentes do STF (Supremo Tribunal Federal).<p> Nesta quarta-feira (6), Bolsonaro afirmou, em sabatina de pré-candidatos promovida pelo jornal Correio Braziliense, que a atual superlotação dos presídios brasileiros é um problema ""de quem cometeu o crime"" e defendeu acabar com as audiências de custódia.<p> Atualmente, o Brasil tem uma taxa de superlotação nas cadeias de 197,4%, o que significa que existe quase o dobro de detentos em relação ao número de vagas.<p> A audiência de custódia consiste na apresentação do preso a um juiz em até 24 horas após a prisão. O objetivo é que a Justiça possa verificar as condições da prisão, como, por exemplo se houve maus tratos ao preso, e determinar se juridicamente há a necessidade de manter o suspeito encarcerado ou se ele pode responder ao processo em liberdade.<p> As audiências de custódia são apontadas como uma forma de evitar a superlotação das cadeias e a prática de abusos pelas forças policiais.<p> ""Eu acho que a chance de alguém que pratica um furto ficar detido é zero junto com a audiência de custódia. Tem de acabar com isso. E não vem com essa historinha 'ah, os presídios são cheios e não recuperam ninguém'. É problema de quem cometeu o crime"", disse Bolsonaro.<p> ",Propostas de Bolsonaro sobre presos contrariam decisões do STF,set(),{'psl'}
0,,pt-lanca-site-de-crowdfunding-para-campanha-de-lula-1528292857408_300x200.jpg,,https://noticias.uol.com.br/politica/eleicoes/2018/noticias/2018/06/07/lula-arrecada-r-50-mil-no-1-dia-o-que-acontece-se-ele-nao-for-candidato.htm,"Reprodução<p>Imagem do site de financiamento coletivo para a campanha de Lula lançado pelo PT<p> Segundo o PT, não há um valor específico de meta a ser arrecadada para a vaquinha. Entre os apoiadores, figuram nomes como a filósofa Márcia Tiburi e os ex-ministros de gestões petistas Ideli Salvatti e Ricardo Berzoini. Até as 11h desta quinta (7) -- um dia depois do site ter sido lançado --, o valor já ultrapassava R$ 70 mil, e mais de 800 pessoas já haviam doado.<p> Lula está preso na sede da PF (Polícia Federal) em Curitiba desde o dia 7 de abril. Ele cumpre pena de 12 anos e um mês de prisão após ser condenado por lavagem de dinheiro e corrupção passiva no caso do tríplex em Guarujá (SP).<p> O PT tem insistido que, mesmo preso, Lula será o candidato do partido à Presidência da República nas eleições deste ano. Condenado em segunda instância pelo TRF-4 (Tribunal Regional Federal da 4ª Região), o ex-presidente se encontra, em tese, inelegível pela Lei da Ficha Limpa e pode ter sua candidatura indeferida pelo TSE (Tribunal Superior Eleitoral).<p> Essa forma de arrecadação passou a ser <p> Mas o que acontece com o dinheiro arrecadado caso a candidatura de Lula seja impedida pela Justiça Eleitoral? Ele pode ser usado pelo PT ou deve ser devolvido aos doadores? Diante da nova lei, especialistas ouvidos pelo <p> Caso o PT apresente o nome de Lula como candidato na convenção partidária que será realizada em julho e depois registre a candidatura em agosto no TSE, o dinheiro pode ser liberado para uso na campanha.<p> ""Ele [Lula] vai ter o direito de fazer campanha enquanto não houver uma decisão sobre o pedido de registro, que vai ser formulada pela Justiça Eleitoral"", afirma João Fernando Lopes de Carvalho, advogado especialista em direito eleitoral.<p> ""É apresentado o registro no TSE e ele começa a fazer campanha. Há uma disposição na lei das eleições de que a pessoa com candidatura sub júdice [em julgamento] pode fazer campanha normalmente"", diz Daniel Falcão, professor do IDP e especialista em direito eleitoral e constitucional.<p> Falcão afirma ainda que não existe um prazo obrigatório a ser cumprido pelo TSE para pronunciamento, apesar de o tribunal ter estabelecido em resolução que deve julgar os registros de candidatura até 17 de setembro. <p> A lei eleitoral estabelece que ""se não for efetivado o registro da candidatura, as entidades arrecadadoras deverão devolver os valores arrecadados aos doadores"".<p> Na visão de Falcão, se após o registro do nome de Lula como candidato –e, consequentemente, após o início da campanha-- houver uma decisão da Justiça Eleitoral que indefira a candidatura, é possível que o PT não precise devolver o dinheiro arrecadado na vaquinha.<p> ""No caso de a candidatura acontecer, nem que seja por alguns dias, ou seja, se for feito o registro do Lula e depois for indeferido pelo TSE, aí eu não vejo necessidade de devolver"", afirma.<p> ""O eleitor do Lula, que é justamente quem está doando, sabe dessa situação e sabe que provavelmente ele não vai poder ser candidato"", pontua.<p> Já no caso de o PT não apresentar o nome de Lula como candidato na convenção partidária, em julho, e decidir inscrever outro nome no TSE ou mesmo desistir de ter uma candidatura próprio, o dinheiro tem que ser devolvido.<p> ""É possível que nessa conjuntura ele [Lula] se apresente como pré-candidato, faça essa movimentação, mas no momento da convenção não venha a propor ao partido o seu nome. Nesse caso, se aplicada a lei, então esse dinheiro tem que ser devolvido"", afirma Carvalho.<p> ""Se até 15 de agosto o Lula não for registrado, eu entenderia isso como uma espécie de não confirmação da pré-candidatura, e o dinheiro tem que ser devolvido"", reforça Falcão.<p> Nesse caso, Carvalho aponta que a devolução do dinheiro deve ser feita pela empresa contratada para administrar a plataforma de financiamento coletivo.<p> ""É o primeiro ano em que se usa vaquinha, em que o sistema de arrecadação antes da campanha é utilizado, então há uma série de dúvidas. Mas me parece que o caminho a ser seguido é este, a empresa devolver [o dinheiro]"", afirma.<p> O partido organiza um ",Vaquinha de Lula soma R$ 56 mil no 1º dia; ele poderá usar o dinheiro?,"{'pr', 'sp'}",{'pt'}
0,,0,,http://www.band.com.br/noticias/eleicoes/conteudo.asp?ID=100000917076&t=bolsonaro-diz-que-na-eleicao-pesara-sempre-suspeicao-de-fraude,0,Bolsonaro diz que na eleição 'pesará sempre suspeição de fraude',set(),set()
0,,0,,http://congressoemfoco.uol.com.br/noticias/%e2%80%9cameaca-ao-sigilo-do-voto%e2%80%9d-stf-derruba-voto-impresso-nas-eleicoes-deste-ano-por-8-votos-a-2/,0,"""Ameaça ao sigilo do voto"": STF derruba voto impresso nas eleições deste ano por 8 votos a 2",set(),set()
0,,0,,https://noticias.uol.com.br/politica/eleicoes/2018/noticias/2018/06/06/pre-candidato-no-rs-bandeira-propoe-privatizar-a-ceee-e-o-banrisul.htm,0,"Pré-candidato no RS, Bandeira propõe privatizar a CEEE e o Banrisul",set(),set()
0,,03abr2018---antes-de-deixar-o-cargo-o-governador-do-estado-de-sao-paulo-geraldo-alckmin-assina-diversos-convenios-com-desenvolve-sp-1523470795568_300x200.jpg,,https://noticias.uol.com.br/politica/eleicoes/2018/noticias/2018/06/06/alckmin-sobre-pressao-para-decolar-nao-tem-estresse-mas-divergencias.htm,"Eliane Neves/Fotoarena/Estadão Conteúdo<p> O ex-governador de São Paulo Geraldo Alckmin (PSDB) minimizou nesta quarta-feira (6) a pressão do próprio partido para deslanchar sua pré-campanha à Presidência da República. ""Não tem estresse. Tem divergências em partido grande"", afirmou, durante sabatina do jornal Correio Braziliense. <p> Em reunião com lideranças do PSDB, <p> Alckmin disse não se impressionar com as pesquisas neste momento, no qual conta com até 10% das intenções de votos nas últimas pesquisas. ""Vamos fazer uma grande aliança. Nós temos hoje praticamente cinco partidos. Nós não vamos divulgar, eles que divulguem, cada um a seu tempo. A gente não pode ser afobado com essas coisas"", afirmou.<p> ""Começar campanha com 7%, 8%, 10% é ótimo"", disse Alckmin, relembrando o caso do ex-prefeito de São Paulo João Doria (PSDB), que começou a campanha de 2016 com apenas um dígito nas pesquisas e acabou eleito no primeiro turno<p> Questionado também sobre o impacto do ex-diretor da Dersa, Paulo Vieira de Souza, o Paulo Preto — apontado como operador do PSDB — em sua campanha, Alckmin foi enfático: ""Nenhum"". O ex-governador ainda disse que risco de ser citado em uma eventual delação é ""zero"". ""Ele mesmo disse à revista Época que nunca me conheceu"", afirmou.<p> Quando perguntado se a situação do senador tucano Aécio Neves (MG) poderia afetar a campanha, Alckmin partiu para o ataque. ""O PSDB não passa a mão na cabeça de ninguém. Todos nós estamos debaixo da lei, contra qualquer tipo de privilégio. Diferente de outros partidos que fazem acampamento na porta de penitenciária.""","Não tem estresse, mas divergências, diz Alckmin sobre pressão para decolar","{'mg', 'sp'}",{'psdb'}
0,,pt-lanca-site-de-crowdfunding-para-campanha-de-lula-1528292857408_300x200.jpg,,https://noticias.uol.com.br/politica/eleicoes/2018/noticias/2018/06/06/pt-lanca-site-de-financiamento-coletivo-para-campanha-de-lula.htm,"Reprodução<p>PT lança site de crowdfunding para campanha de Lula<p> O Partido dos Trabalhadores lançou nesta quarta-feira (6) um site de financiamento coletivo para custear a campanha do pré-candidato da legenda, o ex-presidente Luiz Inácio Lula da Silva, para a Presidência da República. Lula está preso desde o dia 7 de abril na sede da Polícia Federal, em Curitiba, após ser condenado em segunda instância a 12 anos e um mês de prisão, por corrupção passiva e lavagem de dinheiro no caso do tríplex do Guarujá.<p> O site foi lançado por volta das 10h. O <p> Foi a presidente nacional do PT, a senadora Gleisi Hoffmann, quem anunciou por meio de vídeo nas redes sociais do ex-presidente o lançamento do <p> O financiamento coletivo é considerado pelo TSE (Tribunal Superior Eleitoral) mais uma forma de doação, que está sob as mesmas regras de prestação de contas e fiscalização de doações feitas de maneira tradicional. Desde 2015, estão proibidas doações de pessoas jurídicas.<p> Os valores arrecadados —cujo total também será público— só chegarão às campanhas quando a candidatura for registrada, a partir de agosto. Até lá, o dinheiro seguirá retido com as empresas de financiamento coletivo, que deverão devolver a quantia aos doadores em caso de o político não se candidatar.<p> Gleisi também convocou no vídeo de 47 segundos os militantes do PT e apoiadores do ex-presidente Lula a acompanharem ", PT lança site de financiamento coletivo para campanha de Lula ,{'pr'},{'pt'}
